{
  "schemaVersion": 1,
  "id": "shaper.collection_notice",
  "name": "Collection Notice",
  "owner": "shaper",
  "category": "attack",
  "rarity": "common",
  "parameters": {
    "damage": { "base": 5, "upgraded": 8 }
  },
  "energyCost": { "const": 1 },
  "additionalCosts": [],
  "target": "enemy",
  "ingredient": {
    "kind": "form",
    "id": "siphon",
    "prime": { "const": 1 }
  },
  "keywords": [],
  "effects": [
    {
      "op": "damage",
      "target": "selected_enemy",
      "amount": { "param": "damage" },
      "hits": 1,
      "category": "attack"
    }
  ],
  "graftEligible": true,
  "unlockId": null,
  "artId": "card.collection_notice"
}
